

drop database if exists test

create database test

drop database test

create database test

create table t1(c1 TINYINT,
c2 SMALLINT,
c3 MEDIUMINT,
c4 INT,
c5 BIGINT,
c6 DECIMAL,
c7 INT,
c8 BOOL,
c9 FLOAT,
c10 REAL,
c11 DOUBLE,
c12 CHAR,
c13 BINARY,
c14 VARCHAR,
c15 VARBINARY,
c16 TIMESTAMP,
c17 DATETIME,
c18 DATE,
c19 TIME)

create table t2(c1 TINYINT,
c2 SMALLINT,
c3 MEDIUMINT,
c4 INT,
c5 BIGINT,
c6 DECIMAL(4,1),
c7 DECIMAL(7,4),
c8 BOOL,
c9 FLOAT,
c10 REAL,
c11 DOUBLE,
c12 CHAR(9),
c13 BINARY(12),
c14 VARCHAR(11),
c15 VARBINARY,
c16 TIMESTAMP,
c17 DATETIME,
c18 DATE,
c19 TIME)

create table t3(c1 TINYINT,
c2 SMALLINT,
c3 MEDIUMINT,
c4 INT,
c5 BIGINT,
c6 DECIMAL,
c7 INT,
c8 BOOL,
c9 FLOAT,
c10 REAL,
c11 DOUBLE,
c12 CHAR(100),
c13 BINARY(120),
c14 VARCHAR,
c15 VARBINARY(240),
c16 TIMESTAMP,
c17 DATETIME,
c18 DATE,
c19 TIME)

show tables

+----------------+
| tables_in_test |
+----------------+
| t3             |
| t2             |
| t1             |
+----------------+
3 rows in set

desc t1

+-------+----------------+------+------+---------+-------+
| Field | Type           | Null | Key  | Default | Extra |
+-------+----------------+------+------+---------+-------+
| c1    | NUMBER(9, 0)   | YES  |      | NULL    |       |
| c2    | NUMBER(9, 0)   | YES  |      | NULL    |       |
| c3    | NUMBER(18, 0)  | YES  |      | NULL    |       |
| c4    | NUMBER(36, 0)  | YES  |      | NULL    |       |
| c5    | NUMBER(72, 0)  | YES  |      | NULL    |       |
| c6    | NUMBER(72, 38) | YES  |      | NULL    |       |
| c7    | NUMBER(36, 0)  | YES  |      | NULL    |       |
| c8    | NUMBER(9, 0)   | YES  |      | NULL    |       |
| c9    | NUMBER(72, 38) | YES  |      | NULL    |       |
| c10   | NUMBER(72, 38) | YES  |      | NULL    |       |
| c11   | NUMBER(72, 38) | YES  |      | NULL    |       |
| c12   | VARCHAR(10240) | YES  |      | NULL    |       |
| c13   | VARCHAR(10240) | YES  |      | NULL    |       |
| c14   | VARCHAR(10240) | YES  |      | NULL    |       |
| c15   | VARCHAR(10240) | YES  |      | NULL    |       |
| c16   | TIMESTAMP      | YES  |      | NULL    |       |
| c17   | DATETIME       | YES  |      | NULL    |       |
| c18   | DATE           | YES  |      | NULL    |       |
| c19   | TIME           | YES  |      | NULL    |       |
+-------+----------------+------+------+---------+-------+
19 rows in set

desc t2

+-------+----------------+------+------+---------+-------+
| Field | Type           | Null | Key  | Default | Extra |
+-------+----------------+------+------+---------+-------+
| c1    | NUMBER(9, 0)   | YES  |      | NULL    |       |
| c2    | NUMBER(9, 0)   | YES  |      | NULL    |       |
| c3    | NUMBER(18, 0)  | YES  |      | NULL    |       |
| c4    | NUMBER(36, 0)  | YES  |      | NULL    |       |
| c5    | NUMBER(72, 0)  | YES  |      | NULL    |       |
| c6    | NUMBER(4, 1)   | YES  |      | NULL    |       |
| c7    | NUMBER(7, 4)   | YES  |      | NULL    |       |
| c8    | NUMBER(9, 0)   | YES  |      | NULL    |       |
| c9    | NUMBER(72, 38) | YES  |      | NULL    |       |
| c10   | NUMBER(72, 38) | YES  |      | NULL    |       |
| c11   | NUMBER(72, 38) | YES  |      | NULL    |       |
| c12   | VARCHAR(9)     | YES  |      | NULL    |       |
| c13   | VARCHAR(12)    | YES  |      | NULL    |       |
| c14   | VARCHAR(11)    | YES  |      | NULL    |       |
| c15   | VARCHAR(10240) | YES  |      | NULL    |       |
| c16   | TIMESTAMP      | YES  |      | NULL    |       |
| c17   | DATETIME       | YES  |      | NULL    |       |
| c18   | DATE           | YES  |      | NULL    |       |
| c19   | TIME           | YES  |      | NULL    |       |
+-------+----------------+------+------+---------+-------+
19 rows in set

desc t3

+-------+----------------+------+------+---------+-------+
| Field | Type           | Null | Key  | Default | Extra |
+-------+----------------+------+------+---------+-------+
| c1    | NUMBER(9, 0)   | YES  |      | NULL    |       |
| c2    | NUMBER(9, 0)   | YES  |      | NULL    |       |
| c3    | NUMBER(18, 0)  | YES  |      | NULL    |       |
| c4    | NUMBER(36, 0)  | YES  |      | NULL    |       |
| c5    | NUMBER(72, 0)  | YES  |      | NULL    |       |
| c6    | NUMBER(72, 38) | YES  |      | NULL    |       |
| c7    | NUMBER(36, 0)  | YES  |      | NULL    |       |
| c8    | NUMBER(9, 0)   | YES  |      | NULL    |       |
| c9    | NUMBER(72, 38) | YES  |      | NULL    |       |
| c10   | NUMBER(72, 38) | YES  |      | NULL    |       |
| c11   | NUMBER(72, 38) | YES  |      | NULL    |       |
| c12   | VARCHAR(100)   | YES  |      | NULL    |       |
| c13   | VARCHAR(120)   | YES  |      | NULL    |       |
| c14   | VARCHAR(10240) | YES  |      | NULL    |       |
| c15   | VARCHAR(240)   | YES  |      | NULL    |       |
| c16   | TIMESTAMP      | YES  |      | NULL    |       |
| c17   | DATETIME       | YES  |      | NULL    |       |
| c18   | DATE           | YES  |      | NULL    |       |
| c19   | TIME           | YES  |      | NULL    |       |
+-------+----------------+------+------+---------+-------+
19 rows in set

insert into t1 values(1,2,3,4,5,6,7,8,9,10,11,
'12','13','14','15',
'2020-8-1','2020-8-2','2020-8-3','2020-8-4')

insert into t1 select * from t1

insert into t1 select * from t1

insert into t1 select * from t1

select * from t1

+------+------+------+------+------+------+------+------+------+------+------+------+------+------+------+---------------------+---------------------+------------+----------+
| c1   | c2   | c3   | c4   | c5   | c6   | c7   | c8   | c9   | c10  | c11  | c12  | c13  | c14  | c15  | c16                 | c17                 | c18        | c19      |
+------+------+------+------+------+------+------+------+------+------+------+------+------+------+------+---------------------+---------------------+------------+----------+
| 1    | 2    | 3    | 4    | 5    | 6    | 7    | 8    | 9    | 10   | 11   | 12   | 13   | 14   | 15   | 2020-08-01 00:00:00 | 2020-08-02 00:00:00 | 2020-08-03 | 00:00:00 |
| 1    | 2    | 3    | 4    | 5    | 6    | 7    | 8    | 9    | 10   | 11   | 12   | 13   | 14   | 15   | 2020-08-01 00:00:00 | 2020-08-02 00:00:00 | 2020-08-03 | 00:00:00 |
| 1    | 2    | 3    | 4    | 5    | 6    | 7    | 8    | 9    | 10   | 11   | 12   | 13   | 14   | 15   | 2020-08-01 00:00:00 | 2020-08-02 00:00:00 | 2020-08-03 | 00:00:00 |
| 1    | 2    | 3    | 4    | 5    | 6    | 7    | 8    | 9    | 10   | 11   | 12   | 13   | 14   | 15   | 2020-08-01 00:00:00 | 2020-08-02 00:00:00 | 2020-08-03 | 00:00:00 |
| 1    | 2    | 3    | 4    | 5    | 6    | 7    | 8    | 9    | 10   | 11   | 12   | 13   | 14   | 15   | 2020-08-01 00:00:00 | 2020-08-02 00:00:00 | 2020-08-03 | 00:00:00 |
| 1    | 2    | 3    | 4    | 5    | 6    | 7    | 8    | 9    | 10   | 11   | 12   | 13   | 14   | 15   | 2020-08-01 00:00:00 | 2020-08-02 00:00:00 | 2020-08-03 | 00:00:00 |
| 1    | 2    | 3    | 4    | 5    | 6    | 7    | 8    | 9    | 10   | 11   | 12   | 13   | 14   | 15   | 2020-08-01 00:00:00 | 2020-08-02 00:00:00 | 2020-08-03 | 00:00:00 |
| 1    | 2    | 3    | 4    | 5    | 6    | 7    | 8    | 9    | 10   | 11   | 12   | 13   | 14   | 15   | 2020-08-01 00:00:00 | 2020-08-02 00:00:00 | 2020-08-03 | 00:00:00 |
+------+------+------+------+------+------+------+------+------+------+------+------+------+------+------+---------------------+---------------------+------------+----------+
8 rows in set

insert into t2 select * from t1

select * from t2

+------+------+------+------+------+------+--------+------+------+------+------+------+------+------+------+---------------------+---------------------+------------+----------+
| c1   | c2   | c3   | c4   | c5   | c6   | c7     | c8   | c9   | c10  | c11  | c12  | c13  | c14  | c15  | c16                 | c17                 | c18        | c19      |
+------+------+------+------+------+------+--------+------+------+------+------+------+------+------+------+---------------------+---------------------+------------+----------+
| 1    | 2    | 3    | 4    | 5    | 6.0  | 7.0000 | 8    | 9    | 10   | 11   | 12   | 13   | 14   | 15   | 2020-08-01 00:00:00 | 2020-08-02 00:00:00 | 2020-08-03 | 00:00:00 |
| 1    | 2    | 3    | 4    | 5    | 6.0  | 7.0000 | 8    | 9    | 10   | 11   | 12   | 13   | 14   | 15   | 2020-08-01 00:00:00 | 2020-08-02 00:00:00 | 2020-08-03 | 00:00:00 |
| 1    | 2    | 3    | 4    | 5    | 6.0  | 7.0000 | 8    | 9    | 10   | 11   | 12   | 13   | 14   | 15   | 2020-08-01 00:00:00 | 2020-08-02 00:00:00 | 2020-08-03 | 00:00:00 |
| 1    | 2    | 3    | 4    | 5    | 6.0  | 7.0000 | 8    | 9    | 10   | 11   | 12   | 13   | 14   | 15   | 2020-08-01 00:00:00 | 2020-08-02 00:00:00 | 2020-08-03 | 00:00:00 |
| 1    | 2    | 3    | 4    | 5    | 6.0  | 7.0000 | 8    | 9    | 10   | 11   | 12   | 13   | 14   | 15   | 2020-08-01 00:00:00 | 2020-08-02 00:00:00 | 2020-08-03 | 00:00:00 |
| 1    | 2    | 3    | 4    | 5    | 6.0  | 7.0000 | 8    | 9    | 10   | 11   | 12   | 13   | 14   | 15   | 2020-08-01 00:00:00 | 2020-08-02 00:00:00 | 2020-08-03 | 00:00:00 |
| 1    | 2    | 3    | 4    | 5    | 6.0  | 7.0000 | 8    | 9    | 10   | 11   | 12   | 13   | 14   | 15   | 2020-08-01 00:00:00 | 2020-08-02 00:00:00 | 2020-08-03 | 00:00:00 |
| 1    | 2    | 3    | 4    | 5    | 6.0  | 7.0000 | 8    | 9    | 10   | 11   | 12   | 13   | 14   | 15   | 2020-08-01 00:00:00 | 2020-08-02 00:00:00 | 2020-08-03 | 00:00:00 |
+------+------+------+------+------+------+--------+------+------+------+------+------+------+------+------+---------------------+---------------------+------------+----------+
8 rows in set

insert into t3 select * from t1

select * from t3

+------+------+------+------+------+------+------+------+------+------+------+------+------+------+------+---------------------+---------------------+------------+----------+
| c1   | c2   | c3   | c4   | c5   | c6   | c7   | c8   | c9   | c10  | c11  | c12  | c13  | c14  | c15  | c16                 | c17                 | c18        | c19      |
+------+------+------+------+------+------+------+------+------+------+------+------+------+------+------+---------------------+---------------------+------------+----------+
| 1    | 2    | 3    | 4    | 5    | 6    | 7    | 8    | 9    | 10   | 11   | 12   | 13   | 14   | 15   | 2020-08-01 00:00:00 | 2020-08-02 00:00:00 | 2020-08-03 | 00:00:00 |
| 1    | 2    | 3    | 4    | 5    | 6    | 7    | 8    | 9    | 10   | 11   | 12   | 13   | 14   | 15   | 2020-08-01 00:00:00 | 2020-08-02 00:00:00 | 2020-08-03 | 00:00:00 |
| 1    | 2    | 3    | 4    | 5    | 6    | 7    | 8    | 9    | 10   | 11   | 12   | 13   | 14   | 15   | 2020-08-01 00:00:00 | 2020-08-02 00:00:00 | 2020-08-03 | 00:00:00 |
| 1    | 2    | 3    | 4    | 5    | 6    | 7    | 8    | 9    | 10   | 11   | 12   | 13   | 14   | 15   | 2020-08-01 00:00:00 | 2020-08-02 00:00:00 | 2020-08-03 | 00:00:00 |
| 1    | 2    | 3    | 4    | 5    | 6    | 7    | 8    | 9    | 10   | 11   | 12   | 13   | 14   | 15   | 2020-08-01 00:00:00 | 2020-08-02 00:00:00 | 2020-08-03 | 00:00:00 |
| 1    | 2    | 3    | 4    | 5    | 6    | 7    | 8    | 9    | 10   | 11   | 12   | 13   | 14   | 15   | 2020-08-01 00:00:00 | 2020-08-02 00:00:00 | 2020-08-03 | 00:00:00 |
| 1    | 2    | 3    | 4    | 5    | 6    | 7    | 8    | 9    | 10   | 11   | 12   | 13   | 14   | 15   | 2020-08-01 00:00:00 | 2020-08-02 00:00:00 | 2020-08-03 | 00:00:00 |
| 1    | 2    | 3    | 4    | 5    | 6    | 7    | 8    | 9    | 10   | 11   | 12   | 13   | 14   | 15   | 2020-08-01 00:00:00 | 2020-08-02 00:00:00 | 2020-08-03 | 00:00:00 |
+------+------+------+------+------+------+------+------+------+------+------+------+------+------+------+---------------------+---------------------+------------+----------+
8 rows in set

update t1 set c1 = rowid

select * from t1

+------+------+------+------+------+------+------+------+------+------+------+------+------+------+------+---------------------+---------------------+------------+----------+
| c1   | c2   | c3   | c4   | c5   | c6   | c7   | c8   | c9   | c10  | c11  | c12  | c13  | c14  | c15  | c16                 | c17                 | c18        | c19      |
+------+------+------+------+------+------+------+------+------+------+------+------+------+------+------+---------------------+---------------------+------------+----------+
| 0    | 2    | 3    | 4    | 5    | 6    | 7    | 8    | 9    | 10   | 11   | 12   | 13   | 14   | 15   | 2020-08-01 00:00:00 | 2020-08-02 00:00:00 | 2020-08-03 | 00:00:00 |
| 0    | 2    | 3    | 4    | 5    | 6    | 7    | 8    | 9    | 10   | 11   | 12   | 13   | 14   | 15   | 2020-08-01 00:00:00 | 2020-08-02 00:00:00 | 2020-08-03 | 00:00:00 |
| 0    | 2    | 3    | 4    | 5    | 6    | 7    | 8    | 9    | 10   | 11   | 12   | 13   | 14   | 15   | 2020-08-01 00:00:00 | 2020-08-02 00:00:00 | 2020-08-03 | 00:00:00 |
| 0    | 2    | 3    | 4    | 5    | 6    | 7    | 8    | 9    | 10   | 11   | 12   | 13   | 14   | 15   | 2020-08-01 00:00:00 | 2020-08-02 00:00:00 | 2020-08-03 | 00:00:00 |
| 0    | 2    | 3    | 4    | 5    | 6    | 7    | 8    | 9    | 10   | 11   | 12   | 13   | 14   | 15   | 2020-08-01 00:00:00 | 2020-08-02 00:00:00 | 2020-08-03 | 00:00:00 |
| 0    | 2    | 3    | 4    | 5    | 6    | 7    | 8    | 9    | 10   | 11   | 12   | 13   | 14   | 15   | 2020-08-01 00:00:00 | 2020-08-02 00:00:00 | 2020-08-03 | 00:00:00 |
| 0    | 2    | 3    | 4    | 5    | 6    | 7    | 8    | 9    | 10   | 11   | 12   | 13   | 14   | 15   | 2020-08-01 00:00:00 | 2020-08-02 00:00:00 | 2020-08-03 | 00:00:00 |
| 0    | 2    | 3    | 4    | 5    | 6    | 7    | 8    | 9    | 10   | 11   | 12   | 13   | 14   | 15   | 2020-08-01 00:00:00 | 2020-08-02 00:00:00 | 2020-08-03 | 00:00:00 |
+------+------+------+------+------+------+------+------+------+------+------+------+------+------+------+---------------------+---------------------+------------+----------+
8 rows in set

Bye
