

drop database if exists test

create database test

show databases

+-------------+
| databases   |
+-------------+
| test        |
| random_test |
| system      |
+-------------+
3 rows in set

drop database test

show databases

+-------------+
| databases   |
+-------------+
| random_test |
| system      |
+-------------+
2 rows in set

create database test

create table t1(c1 TINYINT,
c2 SMALLINT,
c3 MEDIUMINT,
c4 INT,
c5 BIGINT,
c6 DECIMAL,
c7 NUMERIC,
c8 BOOL,
c9 FLOAT,
c10 REAL,
c11 DOUBLE,
c12 CHAR,
c13 BINARY,
c14 VARCHAR,
c15 VARBINARY,
c16 TIMESTAMP,
c17 DATETIME,
c18 DATE,
c19 TIME)

create table t2(c1 TINYINT,
c2 SMALLINT,
c3 MEDIUMINT,
c4 INT,
c5 BIGINT,
c6 DECIMAL(4),
c7 NUMERIC(7,4),
c8 BOOL,
c9 FLOAT(9),
c10 REAL,
c11 DOUBLE(8,2),
c12 CHAR(9),
c13 BINARY(12),
c14 VARCHAR(11),
c15 VARBINARY,
c16 TIMESTAMP,
c17 DATETIME,
c18 DATE,
c19 TIME)

create table t3(c1 TINYINT,
c2 SMALLINT,
c3 MEDIUMINT,
c4 INT,
c5 BIGINT,
c6 DECIMAL,
c7 NUMERIC,
c8 BOOL,
c9 FLOAT(6),
c10 REAL,
c11 DOUBLE,
c12 CHAR(100),
c13 BINARY(120),
c14 VARCHAR,
c15 VARBINARY(240),
c16 TIMESTAMP,
c17 DATETIME,
c18 DATE,
c19 TIME (2))

show tables

+----------------+
| tables_in_test |
+----------------+
| t3             |
| t2             |
| t1             |
+----------------+
3 rows in set

desc t1

+-------+----------+------+------+---------+-------+
| Field | type     | Null | Key  | Default | Extra |
+-------+----------+------+------+---------+-------+
| c19   | datetime | YES  |      | NULL    |       |
| c18   | datetime | YES  |      | NULL    |       |
| c17   | datetime | YES  |      | NULL    |       |
| c16   | datetime | YES  |      | NULL    |       |
| c15   | varchar  | YES  |      | NULL    |       |
| c14   | varchar  | YES  |      | NULL    |       |
| c13   | varchar  | YES  |      | NULL    |       |
| c12   | varchar  | YES  |      | NULL    |       |
| c11   | double   | YES  |      | NULL    |       |
| c4    | double   | YES  |      | NULL    |       |
| c3    | double   | YES  |      | NULL    |       |
| c2    | double   | YES  |      | NULL    |       |
| c1    | double   | YES  |      | NULL    |       |
| c5    | double   | YES  |      | NULL    |       |
| c6    | double   | YES  |      | NULL    |       |
| c7    | double   | YES  |      | NULL    |       |
| c8    | double   | YES  |      | NULL    |       |
| c9    | double   | YES  |      | NULL    |       |
| c10   | double   | YES  |      | NULL    |       |
+-------+----------+------+------+---------+-------+
19 rows in set

desc t2

+-------+----------+------+------+---------+-------+
| Field | type     | Null | Key  | Default | Extra |
+-------+----------+------+------+---------+-------+
| c19   | datetime | YES  |      | NULL    |       |
| c18   | datetime | YES  |      | NULL    |       |
| c17   | datetime | YES  |      | NULL    |       |
| c16   | datetime | YES  |      | NULL    |       |
| c15   | varchar  | YES  |      | NULL    |       |
| c14   | varchar  | YES  |      | NULL    |       |
| c13   | varchar  | YES  |      | NULL    |       |
| c12   | varchar  | YES  |      | NULL    |       |
| c11   | double   | YES  |      | NULL    |       |
| c4    | double   | YES  |      | NULL    |       |
| c3    | double   | YES  |      | NULL    |       |
| c2    | double   | YES  |      | NULL    |       |
| c1    | double   | YES  |      | NULL    |       |
| c5    | double   | YES  |      | NULL    |       |
| c6    | double   | YES  |      | NULL    |       |
| c7    | double   | YES  |      | NULL    |       |
| c8    | double   | YES  |      | NULL    |       |
| c9    | double   | YES  |      | NULL    |       |
| c10   | double   | YES  |      | NULL    |       |
+-------+----------+------+------+---------+-------+
19 rows in set

desc t3

+-------+----------+------+------+---------+-------+
| Field | type     | Null | Key  | Default | Extra |
+-------+----------+------+------+---------+-------+
| c19   | datetime | YES  |      | NULL    |       |
| c18   | datetime | YES  |      | NULL    |       |
| c17   | datetime | YES  |      | NULL    |       |
| c16   | datetime | YES  |      | NULL    |       |
| c15   | varchar  | YES  |      | NULL    |       |
| c14   | varchar  | YES  |      | NULL    |       |
| c13   | varchar  | YES  |      | NULL    |       |
| c12   | varchar  | YES  |      | NULL    |       |
| c11   | double   | YES  |      | NULL    |       |
| c4    | double   | YES  |      | NULL    |       |
| c3    | double   | YES  |      | NULL    |       |
| c2    | double   | YES  |      | NULL    |       |
| c1    | double   | YES  |      | NULL    |       |
| c5    | double   | YES  |      | NULL    |       |
| c6    | double   | YES  |      | NULL    |       |
| c7    | double   | YES  |      | NULL    |       |
| c8    | double   | YES  |      | NULL    |       |
| c9    | double   | YES  |      | NULL    |       |
| c10   | double   | YES  |      | NULL    |       |
+-------+----------+------+------+---------+-------+
19 rows in set

insert into t1 values(1,2,3,4,5,6,7,8,9,10,11,
"12","13","14","15",
"2020-8-1","2020-8-2","2020-8-3","2020-8-4")

insert into t1 select * from t1

insert into t1 select * from t1

insert into t1 select * from t1

select * from t1

+------+------+------+------+------+------+------+------+------+------+------+------+------+------+------+---------------------+---------------------+---------------------+---------------------+
| c1   | c2   | c3   | c4   | c5   | c6   | c7   | c8   | c9   | c10  | c11  | c12  | c13  | c14  | c15  | c16                 | c17                 | c18                 | c19                 |
+------+------+------+------+------+------+------+------+------+------+------+------+------+------+------+---------------------+---------------------+---------------------+---------------------+
| 1    | 2    | 3    | 4    | 5    | 6    | 7    | 8    | 9    | 10   | 11   | 12   | 13   | 14   | 15   | 2020-08-01 00:00:00 | 2020-08-02 00:00:00 | 2020-08-03 00:00:00 | 2020-08-04 00:00:00 |
| 1    | 2    | 3    | 4    | 5    | 6    | 7    | 8    | 9    | 10   | 11   | 12   | 13   | 14   | 15   | 2020-08-01 00:00:00 | 2020-08-02 00:00:00 | 2020-08-03 00:00:00 | 2020-08-04 00:00:00 |
| 1    | 2    | 3    | 4    | 5    | 6    | 7    | 8    | 9    | 10   | 11   | 12   | 13   | 14   | 15   | 2020-08-01 00:00:00 | 2020-08-02 00:00:00 | 2020-08-03 00:00:00 | 2020-08-04 00:00:00 |
| 1    | 2    | 3    | 4    | 5    | 6    | 7    | 8    | 9    | 10   | 11   | 12   | 13   | 14   | 15   | 2020-08-01 00:00:00 | 2020-08-02 00:00:00 | 2020-08-03 00:00:00 | 2020-08-04 00:00:00 |
| 1    | 2    | 3    | 4    | 5    | 6    | 7    | 8    | 9    | 10   | 11   | 12   | 13   | 14   | 15   | 2020-08-01 00:00:00 | 2020-08-02 00:00:00 | 2020-08-03 00:00:00 | 2020-08-04 00:00:00 |
| 1    | 2    | 3    | 4    | 5    | 6    | 7    | 8    | 9    | 10   | 11   | 12   | 13   | 14   | 15   | 2020-08-01 00:00:00 | 2020-08-02 00:00:00 | 2020-08-03 00:00:00 | 2020-08-04 00:00:00 |
| 1    | 2    | 3    | 4    | 5    | 6    | 7    | 8    | 9    | 10   | 11   | 12   | 13   | 14   | 15   | 2020-08-01 00:00:00 | 2020-08-02 00:00:00 | 2020-08-03 00:00:00 | 2020-08-04 00:00:00 |
| 1    | 2    | 3    | 4    | 5    | 6    | 7    | 8    | 9    | 10   | 11   | 12   | 13   | 14   | 15   | 2020-08-01 00:00:00 | 2020-08-02 00:00:00 | 2020-08-03 00:00:00 | 2020-08-04 00:00:00 |
+------+------+------+------+------+------+------+------+------+------+------+------+------+------+------+---------------------+---------------------+---------------------+---------------------+
8 rows in set

insert into t2 select * from t1

select * from t2

+------+------+------+------+------+------+------+------+------+------+------+------+------+------+------+---------------------+---------------------+---------------------+---------------------+
| c1   | c2   | c3   | c4   | c5   | c6   | c7   | c8   | c9   | c10  | c11  | c12  | c13  | c14  | c15  | c16                 | c17                 | c18                 | c19                 |
+------+------+------+------+------+------+------+------+------+------+------+------+------+------+------+---------------------+---------------------+---------------------+---------------------+
| 1    | 2    | 3    | 4    | 5    | 6    | 7    | 8    | 9    | 10   | 11   | 12   | 13   | 14   | 15   | 2020-08-01 00:00:00 | 2020-08-02 00:00:00 | 2020-08-03 00:00:00 | 2020-08-04 00:00:00 |
| 1    | 2    | 3    | 4    | 5    | 6    | 7    | 8    | 9    | 10   | 11   | 12   | 13   | 14   | 15   | 2020-08-01 00:00:00 | 2020-08-02 00:00:00 | 2020-08-03 00:00:00 | 2020-08-04 00:00:00 |
| 1    | 2    | 3    | 4    | 5    | 6    | 7    | 8    | 9    | 10   | 11   | 12   | 13   | 14   | 15   | 2020-08-01 00:00:00 | 2020-08-02 00:00:00 | 2020-08-03 00:00:00 | 2020-08-04 00:00:00 |
| 1    | 2    | 3    | 4    | 5    | 6    | 7    | 8    | 9    | 10   | 11   | 12   | 13   | 14   | 15   | 2020-08-01 00:00:00 | 2020-08-02 00:00:00 | 2020-08-03 00:00:00 | 2020-08-04 00:00:00 |
| 1    | 2    | 3    | 4    | 5    | 6    | 7    | 8    | 9    | 10   | 11   | 12   | 13   | 14   | 15   | 2020-08-01 00:00:00 | 2020-08-02 00:00:00 | 2020-08-03 00:00:00 | 2020-08-04 00:00:00 |
| 1    | 2    | 3    | 4    | 5    | 6    | 7    | 8    | 9    | 10   | 11   | 12   | 13   | 14   | 15   | 2020-08-01 00:00:00 | 2020-08-02 00:00:00 | 2020-08-03 00:00:00 | 2020-08-04 00:00:00 |
| 1    | 2    | 3    | 4    | 5    | 6    | 7    | 8    | 9    | 10   | 11   | 12   | 13   | 14   | 15   | 2020-08-01 00:00:00 | 2020-08-02 00:00:00 | 2020-08-03 00:00:00 | 2020-08-04 00:00:00 |
| 1    | 2    | 3    | 4    | 5    | 6    | 7    | 8    | 9    | 10   | 11   | 12   | 13   | 14   | 15   | 2020-08-01 00:00:00 | 2020-08-02 00:00:00 | 2020-08-03 00:00:00 | 2020-08-04 00:00:00 |
+------+------+------+------+------+------+------+------+------+------+------+------+------+------+------+---------------------+---------------------+---------------------+---------------------+
8 rows in set

insert into t3 select * from t1

select * from t3

+------+------+------+------+------+------+------+------+------+------+------+------+------+------+------+---------------------+---------------------+---------------------+---------------------+
| c1   | c2   | c3   | c4   | c5   | c6   | c7   | c8   | c9   | c10  | c11  | c12  | c13  | c14  | c15  | c16                 | c17                 | c18                 | c19                 |
+------+------+------+------+------+------+------+------+------+------+------+------+------+------+------+---------------------+---------------------+---------------------+---------------------+
| 1    | 2    | 3    | 4    | 5    | 6    | 7    | 8    | 9    | 10   | 11   | 12   | 13   | 14   | 15   | 2020-08-01 00:00:00 | 2020-08-02 00:00:00 | 2020-08-03 00:00:00 | 2020-08-04 00:00:00 |
| 1    | 2    | 3    | 4    | 5    | 6    | 7    | 8    | 9    | 10   | 11   | 12   | 13   | 14   | 15   | 2020-08-01 00:00:00 | 2020-08-02 00:00:00 | 2020-08-03 00:00:00 | 2020-08-04 00:00:00 |
| 1    | 2    | 3    | 4    | 5    | 6    | 7    | 8    | 9    | 10   | 11   | 12   | 13   | 14   | 15   | 2020-08-01 00:00:00 | 2020-08-02 00:00:00 | 2020-08-03 00:00:00 | 2020-08-04 00:00:00 |
| 1    | 2    | 3    | 4    | 5    | 6    | 7    | 8    | 9    | 10   | 11   | 12   | 13   | 14   | 15   | 2020-08-01 00:00:00 | 2020-08-02 00:00:00 | 2020-08-03 00:00:00 | 2020-08-04 00:00:00 |
| 1    | 2    | 3    | 4    | 5    | 6    | 7    | 8    | 9    | 10   | 11   | 12   | 13   | 14   | 15   | 2020-08-01 00:00:00 | 2020-08-02 00:00:00 | 2020-08-03 00:00:00 | 2020-08-04 00:00:00 |
| 1    | 2    | 3    | 4    | 5    | 6    | 7    | 8    | 9    | 10   | 11   | 12   | 13   | 14   | 15   | 2020-08-01 00:00:00 | 2020-08-02 00:00:00 | 2020-08-03 00:00:00 | 2020-08-04 00:00:00 |
| 1    | 2    | 3    | 4    | 5    | 6    | 7    | 8    | 9    | 10   | 11   | 12   | 13   | 14   | 15   | 2020-08-01 00:00:00 | 2020-08-02 00:00:00 | 2020-08-03 00:00:00 | 2020-08-04 00:00:00 |
| 1    | 2    | 3    | 4    | 5    | 6    | 7    | 8    | 9    | 10   | 11   | 12   | 13   | 14   | 15   | 2020-08-01 00:00:00 | 2020-08-02 00:00:00 | 2020-08-03 00:00:00 | 2020-08-04 00:00:00 |
+------+------+------+------+------+------+------+------+------+------+------+------+------+------+------+---------------------+---------------------+---------------------+---------------------+
8 rows in set

update t1 set c1 = rowid

select * from t1

+----------+------+------+------+------+------+------+------+------+------+------+------+------+------+------+---------------------+---------------------+---------------------+---------------------+
| c1       | c2   | c3   | c4   | c5   | c6   | c7   | c8   | c9   | c10  | c11  | c12  | c13  | c14  | c15  | c16                 | c17                 | c18                 | c19                 |
+----------+------+------+------+------+------+------+------+------+------+------+------+------+------+------+---------------------+---------------------+---------------------+---------------------+
| 0.000000 | 2    | 3    | 4    | 5    | 6    | 7    | 8    | 9    | 10   | 11   | 12   | 13   | 14   | 15   | 2020-08-01 00:00:00 | 2020-08-02 00:00:00 | 2020-08-03 00:00:00 | 2020-08-04 00:00:00 |
| 1.000000 | 2    | 3    | 4    | 5    | 6    | 7    | 8    | 9    | 10   | 11   | 12   | 13   | 14   | 15   | 2020-08-01 00:00:00 | 2020-08-02 00:00:00 | 2020-08-03 00:00:00 | 2020-08-04 00:00:00 |
| 2.000000 | 2    | 3    | 4    | 5    | 6    | 7    | 8    | 9    | 10   | 11   | 12   | 13   | 14   | 15   | 2020-08-01 00:00:00 | 2020-08-02 00:00:00 | 2020-08-03 00:00:00 | 2020-08-04 00:00:00 |
| 3.000000 | 2    | 3    | 4    | 5    | 6    | 7    | 8    | 9    | 10   | 11   | 12   | 13   | 14   | 15   | 2020-08-01 00:00:00 | 2020-08-02 00:00:00 | 2020-08-03 00:00:00 | 2020-08-04 00:00:00 |
| 4.000000 | 2    | 3    | 4    | 5    | 6    | 7    | 8    | 9    | 10   | 11   | 12   | 13   | 14   | 15   | 2020-08-01 00:00:00 | 2020-08-02 00:00:00 | 2020-08-03 00:00:00 | 2020-08-04 00:00:00 |
| 5.000000 | 2    | 3    | 4    | 5    | 6    | 7    | 8    | 9    | 10   | 11   | 12   | 13   | 14   | 15   | 2020-08-01 00:00:00 | 2020-08-02 00:00:00 | 2020-08-03 00:00:00 | 2020-08-04 00:00:00 |
| 6.000000 | 2    | 3    | 4    | 5    | 6    | 7    | 8    | 9    | 10   | 11   | 12   | 13   | 14   | 15   | 2020-08-01 00:00:00 | 2020-08-02 00:00:00 | 2020-08-03 00:00:00 | 2020-08-04 00:00:00 |
| 7.000000 | 2    | 3    | 4    | 5    | 6    | 7    | 8    | 9    | 10   | 11   | 12   | 13   | 14   | 15   | 2020-08-01 00:00:00 | 2020-08-02 00:00:00 | 2020-08-03 00:00:00 | 2020-08-04 00:00:00 |
+----------+------+------+------+------+------+------+------+------+------+------+------+------+------+------+---------------------+---------------------+---------------------+---------------------+
8 rows in set

Bye
